{
  "$schema": "https://json-schema.org/draft/2020-12/schema",
  "$id": "https://aegis-initiative.com/schemas/agp/action_propose.schema.json",
  "title": "AGP ACTION_PROPOSE",
  "type": "object",
  "required": ["message_type", "action_id", "timestamp", "actor", "capability", "resource", "parameters"],
  "additionalProperties": false,
  "properties": {
    "message_type": { "const": "ACTION_PROPOSE" },
    "action_id": {
      "type": "string",
      "pattern": "^a-[a-zA-Z0-9_-]+$"
    },
    "timestamp": {
      "type": "string",
      "pattern": "^\\d{4}-\\d{2}-\\d{2}T\\d{2}:\\d{2}:\\d{2}Z$"
    },
    "actor": {
      "$ref": "https://aegis-initiative.com/schemas/common/actor.schema.json"
    },
    "capability": {
      "$ref": "https://aegis-initiative.com/schemas/common/capability-id.schema.json"
    },
    "resource": {
      "type": "string",
      "minLength": 1
    },
    "parameters": {
      "type": "object"
    },
    "trace_id": {
      "type": "string"
    }
  }
}
